{
  "schema_version": 1,
  "updated": "2026-10-11",
  "target_convocatoria": "li-test-obj",
  "convocatorias": [
    {
      "id": "li-test-obj",
      "access": "libre",
      "year": 2025,
      "oep": "2025",
      "title": "Convocatoria de prueba 2025",
      "resolution": null,
      "boe_id": null,
      "exam_date": "2026-05-23",
      "status": "examen_realizado",
      "scoring_scheme": "tai-test-partes",
      "plazas": {
        "general": 90,
        "discapacidad": 10,
        "total": 100
      },
      "admitidos": 2000,
      "presentados": 1000,
      "aptos": null,
      "aprobados": null,
      "cutoff": null,
      "grades_of_aptos": null,
      "destinations_dataset": null,
      "sources": [
        {
          "title": "Fuente de prueba",
          "url": "https://example.org/obj"
        }
      ],
      "notes": null
    },
    {
      "id": "li-test",
      "access": "libre",
      "year": 2024,
      "oep": "2024",
      "title": "Convocatoria de prueba 2024",
      "resolution": null,
      "boe_id": null,
      "exam_date": "2024-12-14",
      "status": "finalizada",
      "scoring_scheme": "tai-test",
      "plazas": {
        "general": 280,
        "discapacidad": 20,
        "total": 300
      },
      "admitidos": 1800,
      "presentados": 1000,
      "aptos": 250,
      "aprobados": 250,
      "cutoff": {
        "direct": 7.8,
        "max_direct": 26.0,
        "grade": 50.0,
        "basis": "floor",
        "per_part": null
      },
      "grades_of_aptos": {
        "source": "Relación de aprobados (sintética)",
        "count": 250,
        "values": [
          95.0,
          94.82,
          94.64,
          94.46,
          94.28,
          94.1,
          93.92,
          93.73,
          93.55,
          93.37,
          93.19,
          93.01,
          92.83,
          92.65,
          92.47,
          92.29,
          92.11,
          91.93,
          91.75,
          91.57,
          91.39,
          91.2,
          91.02,
          90.84,
          90.66,
          90.48,
          90.3,
          90.12,
          89.94,
          89.76,
          89.58,
          89.4,
          89.22,
          89.04,
          88.86,
          88.67,
          88.49,
          88.31,
          88.13,
          87.95,
          87.77,
          87.59,
          87.41,
          87.23,
          87.05,
          86.87,
          86.69,
          86.51,
          86.33,
          86.14,
          85.96,
          85.78,
          85.6,
          85.42,
          85.24,
          85.06,
          84.88,
          84.7,
          84.52,
          84.34,
          84.16,
          83.98,
          83.8,
          83.61,
          83.43,
          83.25,
          83.07,
          82.89,
          82.71,
          82.53,
          82.35,
          82.17,
          81.99,
          81.81,
          81.63,
          81.45,
          81.27,
          81.08,
          80.9,
          80.72,
          80.54,
          80.36,
          80.18,
          80.0,
          79.82,
          79.64,
          79.46,
          79.28,
          79.1,
          78.92,
          78.73,
          78.55,
          78.37,
          78.19,
          78.01,
          77.83,
          77.65,
          77.47,
          77.29,
          77.11,
          76.93,
          76.75,
          76.57,
          76.39,
          76.2,
          76.02,
          75.84,
          75.66,
          75.48,
          75.3,
          75.12,
          74.94,
          74.76,
          74.58,
          74.4,
          74.22,
          74.04,
          73.86,
          73.67,
          73.49,
          73.31,
          73.13,
          72.95,
          72.77,
          72.59,
          72.41,
          72.23,
          72.05,
          71.87,
          71.69,
          71.51,
          71.33,
          71.14,
          70.96,
          70.78,
          70.6,
          70.42,
          70.24,
          70.06,
          69.88,
          69.7,
          69.52,
          69.34,
          69.16,
          68.98,
          68.8,
          68.61,
          68.43,
          68.25,
          68.07,
          67.89,
          67.71,
          67.53,
          67.35,
          67.17,
          66.99,
          66.81,
          66.63,
          66.45,
          66.27,
          66.08,
          65.9,
          65.72,
          65.54,
          65.36,
          65.18,
          65.0,
          64.82,
          64.64,
          64.46,
          64.28,
          64.1,
          63.92,
          63.73,
          63.55,
          63.37,
          63.19,
          63.01,
          62.83,
          62.65,
          62.47,
          62.29,
          62.11,
          61.93,
          61.75,
          61.57,
          61.39,
          61.2,
          61.02,
          60.84,
          60.66,
          60.48,
          60.3,
          60.12,
          59.94,
          59.76,
          59.58,
          59.4,
          59.22,
          59.04,
          58.86,
          58.67,
          58.49,
          58.31,
          58.13,
          57.95,
          57.77,
          57.59,
          57.41,
          57.23,
          57.05,
          56.87,
          56.69,
          56.51,
          56.33,
          56.14,
          55.96,
          55.78,
          55.6,
          55.42,
          55.24,
          55.06,
          54.88,
          54.7,
          54.52,
          54.34,
          54.16,
          53.98,
          53.8,
          53.61,
          53.43,
          53.25,
          53.07,
          52.89,
          52.71,
          52.53,
          52.35,
          52.17,
          51.99,
          51.81,
          51.63,
          51.45,
          51.27,
          51.08,
          50.9,
          50.72,
          50.54,
          50.36,
          50.18,
          50.0
        ]
      },
      "destinations_dataset": "destinos/li-test.json",
      "sources": [
        {
          "title": "Fuente de prueba",
          "url": "https://example.org/ref"
        }
      ],
      "notes": null
    }
  ]
}
